{
  "id": "ex:le_authorised_rbi_use",
  "title": "Authorised LE use of real-time RBI in publicly accessible spaces (Art. 5(1)(h) exceptions; 5(2))",
  "namespace": "ex",
  "article_refs": [
    { "article": 5, "paragraph": 1, "point": "(h)" },
    { "article": 5, "paragraph": 2 }
  ],
  "logic": {
    "root": "R-1",
    "nodes": [
      { "id": "R-1", "label": "All exception conditions hold", "kind": "composite", "operator": "allOf", "children": ["R-1.1", "R-1.2", "R-1.3"] },
      { "id": "R-1.1", "label": "Objective permitted (i/ii/iii)", "kind": "composite", "operator": "anyOf", "children": ["R-1.1.1", "R-1.1.2", "R-1.1.3"], "sources": [ { "article": 5, "paragraph": 1 } ] },
      { "id": "R-1.1.1", "label": "Search for victims/missing persons", "kind": "primitive", "question": { "prompt": "Is the use for targeted search for specific victims of abduction/trafficking/sexual exploitation or missing persons?", "answer_type": "boolean" }, "sources": [ { "article": 5, "paragraph": 1 } ] },
      { "id": "R-1.1.2", "label": "Prevent specific, substantial and imminent threat (incl. terrorist)", "kind": "primitive", "question": { "prompt": "Is the use to prevent a specific, substantial and imminent threat to life or physical safety or a genuine and present/foreseeable terrorist threat?", "answer_type": "boolean" }, "sources": [ { "article": 5, "paragraph": 1 } ] },
      { "id": "R-1.1.3", "label": "Locate/identify suspect for listed serious offences (>=4 years)", "kind": "primitive", "question": { "prompt": "Is the use to locate or identify a suspect for offences in Annex II punishable by at least 4 years in the Member State?", "answer_type": "boolean" }, "sources": [ { "article": 5, "paragraph": 1 } ] },
      { "id": "R-1.2", "label": "Only to confirm identity of a specifically targeted individual", "kind": "primitive", "question": { "prompt": "Is the use only to confirm the identity of a specifically targeted individual?", "answer_type": "boolean" }, "sources": [ { "article": 5, "paragraph": 2 } ] },
      { "id": "R-1.3", "label": "Authorisation and safeguards present (per procedural requirements)", "kind": "primitive", "question": { "prompt": "Is the use authorised and subject to applicable procedural safeguards?", "answer_type": "boolean", "help": "Confirm that authorisations/notifications required under applicable law are in place and that use is time-bound, targeted, and proportionate." }, "sources": [ { "article": 5, "paragraph": 2 } ] }
    ]
  },
  "metadata": { "version": "1.0", "status": "draft", "extraction_date": "2025-10-20" }
}

