{
  "id": "ctx:is_employer",
  "title": "Deployer acts as employer (workplace context)",
  "namespace": "ctx",
  "article_refs": [ { "article": 26, "paragraph": 7 } ],
  "logic": {
    "root": "R-1",
    "nodes": [
      {
        "id": "R-1",
        "label": "Deployers at the workplace (employer status)",
        "kind": "primitive",
        "question": {
          "prompt": "Is the deployer an employer putting a high-risk AI system into service or use at the workplace?",
          "answer_type": "boolean"
        },
        "sources": [ { "article": 26, "paragraph": 7 } ]
      }
    ]
  },
  "metadata": { "version": "1.0", "status": "draft", "extraction_date": "2025-10-21" }
}

