{
  "id": "sys:is_post_remote_biometric_identification",
  "title": "High-risk AI system for post-remote biometric identification",
  "namespace": "sys",
  "article_refs": [ { "article": 26, "paragraph": 10 } ],
  "logic": {
    "root": "R-1",
    "nodes": [
      {
        "id": "R-1",
        "label": "Post-remote biometric identification use",
        "kind": "primitive",
        "question": {
          "prompt": "Is the high-risk AI system used for post-remote biometric identification?",
          "answer_type": "boolean"
        },
        "sources": [ { "article": 26, "paragraph": 10 } ],
        "context": {
          "items": [
            { "label": "Definition context", "kind": "guidance", "text": "Post-remote biometric identification concerns identification without active involvement, not in real-time; see Recitals for context.", "sources": [ { "article": 0, "quote": "Recital (17)" }, { "article": 12, "paragraph": 3 } ] }
          ]
        }
      }
    ]
  },
  "metadata": { "version": "1.0", "status": "draft", "extraction_date": "2025-10-21" }
}

