{
  "id": "qp:is_distributor",
  "title": "Actor is a distributor of a high-risk AI system",
  "namespace": "qp",
  "article_refs": [ { "article": 24 } ],
  "logic": {
    "root": "R-1",
    "nodes": [
      {
        "id": "R-1",
        "label": "Distributor role",
        "kind": "primitive",
        "question": {
          "prompt": "Is the actor a distributor of a high-risk AI system?",
          "answer_type": "boolean"
        },
        "sources": [ { "article": 24 } ]
      }
    ]
  },
  "metadata": { "version": "1.0", "status": "draft", "extraction_date": "2025-10-21" }
}

