{
  "id": "sys:is_annexIII_point_2",
  "title": "System intended to be used in the area listed in Annex III point 2",
  "namespace": "sys",
  "article_refs": [ { "article": 27, "paragraph": 1 } ],
  "logic": {
    "root": "R-1",
    "nodes": [
      {
        "id": "R-1",
        "label": "Annex III point 2 use area",
        "kind": "primitive",
        "question": {
          "prompt": "Is the high-risk AI system intended to be used in the area listed in Annex III point 2?",
          "answer_type": "boolean"
        },
        "sources": [ { "article": 27, "paragraph": 1 } ]
      }
    ]
  },
  "metadata": { "version": "1.0", "status": "draft", "extraction_date": "2025-10-21" }
}

