{
  "id": "sys:exploits_vulnerabilities_age_disability_socioeconomic",
  "title": "Exploits vulnerabilities due to age/disability/specific social or economic situation (Art. 5(1)(b))",
  "namespace": "sys",
  "article_refs": [ { "article": 5, "paragraph": 1, "point": "(b)" } ],
  "logic": { "root": "R-1", "nodes": [
    { "id": "R-1", "label": "Exploitation of vulnerabilities (age/disability/social/economic)", "kind": "primitive",
      "question": { "prompt": "Does the AI system exploit vulnerabilities of a person or a specific group due to their age, disability, or a specific social or economic situation?", "answer_type": "boolean" },
      "sources": [ { "article": 5, "paragraph": 1, "point": "(b)" } ] }
  ] },
  "metadata": { "version": "1.0", "status": "draft", "extraction_date": "2025-10-20" }
}

